{
  "$schema": "../../../schema/release-profile.schema.json",
  "schemaVersion": 2,
  "name": "layerscape",
  "repository": {
    "id": 1187527897,
    "fullName": "splrad/LayerScape"
  },
  "release": {
    "draftDuringUpload": true,
    "prerelease": false,
    "makeLatest": true,
    "requireImmutablePolicy": true
  },
  "releaseNotes": {
    "profile": "common-v3",
    "personalization": {
      "enabled": false,
      "sections": []
    }
  }
}
